{
  "id": "kr-modern-transition",
  "title": "개항과 국권 수호",
  "period": [
    1863,
    1910
  ],
  "order": 5,
  "summary": "정치·경제·사회·문화의 핵심 흐름을 지도 사건과 연결하고, 자체 제작 5지선다 문제로 시대와 개념을 구분합니다.",
  "topicIds": [
    "kr-modern-transition"
  ],
  "sections": [
    {
      "id": "s1",
      "title": "흥선대원군과 통상 수교 거부",
      "body": "왕권 재건 정책과 대외 방어를 구분해 읽는다. 경복궁 중건, 서원 철폐, 호포제는 같은 집권기의 정책이지만 목표와 사회적 효과가 다르다.\n\n흥선대원군 집권과 왕권 재건 — 고종의 즉위로 정국을 이끌게 된 흥선대원군은 세도 가문의 권력을 줄이고 왕실 중심의 통치 질서를 되살리려 했다. 비변사를 없애고 의정부와 삼군부의 기능을 나누었으며, 경복궁 중건과 서원 정리도 추진했다. 이는 신분제를 폐지하거나 의회를 만드는 개혁과는 목적이 달랐다. 집권 날짜는 당시 음력 1863년 12월 기준이다. 호포제는 양반에게도 군포 부담을 지워 부담의 불균형을 줄이려는 조치였다. 사창제와 서원 정리에는 농민 생활을 안정시키려는 의도가 있었지만, 경복궁 중건을 위한 원납전과 당백전 발행은 백성의 부담과 물가 불안을 키웠다. 같은 집권기의 정책도 수혜와 비용을 나누어 살펴야 한다.\n\n병인양요 — 프랑스는 천주교 박해로 자국 선교사들이 처형된 일을 구실로 강화도를 침공했다. 조선군은 문수산성과 정족산성 일대에서 맞섰으며 양헌수 부대의 정족산성 전투가 프랑스군 철수에 기여했다. 수도로 통하는 강화 해협의 위치 때문에 이곳은 이후에도 외세와 충돌하는 관문이 되었다. 침공은 천주교 신자에 대한 국내 박해와 서양 군대의 보복이 연결된 사건이었다. 프랑스군은 철수하면서 외규장각 도서 등을 반출했다. 전투의 승패와 별개로 지역 주민의 피해와 문화재 약탈이 남았다는 점에서, 군사적 방어와 문화유산의 손실을 함께 기억해야 한다.\n\n신미양요와 척화비 — 미국은 제너럴 셔먼호 사건을 내세우며 조선에 통상을 요구했고, 협상이 결렬된 뒤 강화도에서 군사 충돌이 벌어졌다. 어재연 등이 광성보를 지키다 전사했지만 미국 함대는 통상 조약을 얻지 못한 채 물러났다. 병인양요의 프랑스, 신미양요의 미국을 구별하면 사건의 순서가 분명해진다. 흥선대원군은 서양과 화친하는 것을 경계하는 척화비를 세워 통상 수교 거부 의지를 드러냈다. 이는 침략에 맞선 주권 수호의 성격이 있었지만 새로운 국제 질서에 대응할 외교 통로를 좁히는 결과도 낳았다. 지도에서는 평양의 셔먼호 사건과 강화도의 전투가 서로 다른 장소임을 확인하자.",
      "keyPoints": [
        "비변사 폐지: 의정부·삼군부 기능 회복",
        "병인양요(1866) 프랑스 → 신미양요(1871) 미국",
        "호포제와 갑오개혁의 신분제 폐지를 구별"
      ],
      "eventRefs": [
        {
          "topicId": "kr-modern-transition",
          "eventId": "daewongun-reform"
        },
        {
          "topicId": "kr-modern-transition",
          "eventId": "byeongin-invasion"
        },
        {
          "topicId": "kr-modern-transition",
          "eventId": "sinmi-invasion"
        }
      ],
      "sources": [
        "https://contents.history.go.kr/front/hm/view.do?levelId=hm_101_0010",
        "https://encykorea.aks.ac.kr/Article/E0005160",
        "https://contents.history.go.kr/mobile/kc/view.do?levelId=kc_i400800"
      ]
    },
    {
      "id": "s2",
      "title": "개항과 개화 정책의 갈등",
      "body": "강화도 조약 이후 조선이 세계 시장에 편입되는 과정에서 개화 정책과 사회적 비용이 충돌한다. 통리기무아문과 별기군은 임오군란보다 앞선다.\n\n강화도 조약과 개항 — 운요호 사건을 구실로 압박한 일본과 조선은 강화도 조약을 맺었다. 조약은 조선을 자주국이라 표현해 청의 영향력을 배제하려 했으며, 부산 외 두 항구의 개항, 해안 측량권과 영사 재판권 등을 규정했다. 형식상 국가 간 평등을 말하면서 실제로는 일본에 일방적인 권리를 준 불평등 조약이었다. 개항 뒤 원산과 인천이 차례로 열리면서 외국 상품과 상인이 들어오는 통로가 늘었다. 부속 조약은 일본 화폐 유통과 무관세 무역 등을 허용해 상인과 농민의 경제생활에도 영향을 주었다. 근대적 조약이라는 성격과 조선 측 권리가 충분히 보호되지 않았다는 성격은 동시에 성립한다.\n\n통리기무아문 설치와 개화 정책 — 정부는 통리기무아문을 두고 외교·군사 등 개화 사무를 나누어 담당하게 했다. 일본에 조사시찰단, 청에 영선사를 보내 제도와 기술을 배우게 했고 신식 군대 별기군을 편성했다. 기존 질서를 유지하면서 기술과 제도를 선택적으로 수용하려는 정책은 급진 개화파의 정치 개혁 구상과 구별된다. 날짜는 통상 쓰이는 음력 1880년 12월을 따른다. 새 군대가 우대받는 동안 구식 군인의 급료 체불과 차별은 누적되었다. 개화 정책의 방향 자체뿐 아니라 비용을 누가 부담하고 혜택을 누가 받는지가 갈등의 원인이었다. 따라서 임오군란은 단순한 신문물 거부가 아니라 군인과 도시민의 생계 불만까지 함께 읽어야 이해할 수 있다.\n\n임오군란 — 구식 군인들의 급료 체불과 부당한 지급에서 시작된 봉기는 정부 고관과 일본 공사관을 향했다. 흥선대원군이 잠시 정권을 잡았으나 청군의 개입으로 청에 끌려갔다. 사건 뒤 청의 내정 간섭이 강화되고 일본과 제물포 조약이 체결되면서 조선의 외교적 자율성은 더욱 좁아졌다. 군인들의 분노에는 신식 군대와의 차별, 생활고와 집권층의 부패가 겹쳐 있었다. 사건 이후 배상금과 외국군 주둔 부담은 다시 조선 사회에 돌아왔다. 조청 상민 수륙 무역 장정으로 청 상인의 내륙 진출이 확대되었다는 점도 정치적 개입과 경제적 침투를 연결해 보여 준다.",
      "keyPoints": [
        "강화도 조약: 영사 재판권·해안 측량권, 불평등 조약",
        "1880 통리기무아문 → 1881 별기군 → 1882 임오군란",
        "임오군란 뒤 제물포 조약·조청 상민 수륙 무역 장정"
      ],
      "eventRefs": [
        {
          "topicId": "kr-modern-transition",
          "eventId": "ganghwa-treaty"
        },
        {
          "topicId": "kr-modern-transition",
          "eventId": "reform-offices"
        },
        {
          "topicId": "kr-modern-transition",
          "eventId": "imo-mutiny"
        }
      ],
      "sources": [
        "https://contents.history.go.kr/mobile/kc/view.do?levelId=kc_i400800",
        "https://encykorea.aks.ac.kr/Article/E0059315",
        "https://encykorea.aks.ac.kr/Article/E0047565",
        "https://encykorea.aks.ac.kr/Article/E0000922"
      ]
    },
    {
      "id": "s3",
      "title": "갑신정변·동학농민운동·갑오개혁 비교",
      "body": "1884년 급진 개화파의 정변, 1894년 농민 운동, 같은 해 정부의 갑오개혁은 주도층·방법·외세와의 관계가 다르다. 신분제의 법적 폐지는 갑오개혁에서 실현되었다.\n\n갑신정변 — 김옥균·박영효 등 급진 개화파는 우정총국 개국 축하연을 계기로 정변을 일으켰다. 청에 대한 의존을 줄이고 문벌 폐지, 능력에 따른 인재 등용, 재정 일원화 등을 지향했으나 청군 개입으로 사흘 만에 실패했다. 일본의 지원에 의존한 방식과 취약한 정치 기반도 실패의 원인으로 꼽힌다. 일반 백성에게 정변의 개혁 목표가 충분히 전달되거나 지지 기반으로 조직되지는 못했다. 외국군에 의지한 권력 교체는 기존 개화 정책의 비용을 겪던 사람들에게 불신을 낳았다. 실패 뒤 한성 조약과 청일 톈진 조약이 이어져, 국내 개혁의 좌절이 국제적 간섭의 확대와 연결되었다.\n\n동학농민운동: 고부에서 전주까지 — 고부 군수 조병갑의 수탈에 항거한 농민 봉기 뒤 전봉준 등이 이끄는 농민군이 본격적으로 일어났다. 황토현·황룡촌에서 관군을 물리치고 전주성을 점령했다. 정부가 청군을 불러들이자 일본도 군대를 파견했으며, 조선의 내부 위기는 청일 간 전쟁으로 번질 조건을 갖추었다. 농민군은 탐관오리의 횡포를 고치고 생활을 안정시키려 했다. 전주 화약 뒤 설치된 집강소는 농민이 지역의 폐정을 바로잡는 데 참여한 공간이었다. 동학의 종교 조직과 평등 지향은 농민을 연결하는 기반이 되었지만, 운동 참가자의 요구가 모두 하나의 완성된 근대 이념이었던 것은 아니다.\n\n갑오개혁과 신분제 폐지 — 일본군의 경복궁 점령과 청일전쟁 속에서 군국기무처를 중심으로 갑오개혁이 추진되었다. 과거제와 신분제를 없애고 재정을 탁지아문으로 모으며 조세의 금납화를 추진했다. 뒤이은 홍범 14조는 왕실과 국정의 분리 등을 내세웠다. 개혁 내용과 외세의 군사적 압박이라는 추진 조건을 함께 보아야 한다. 공사 노비제와 신분 차별의 법적 폐지, 과부 재가 허용 등은 생활 질서를 크게 바꾸는 조치였다. 그러나 법의 변화만으로 일상적 차별이 즉시 사라지지는 않았고 농민의 토지 문제도 근본적으로 해결되지 않았다. 농민층의 요구와 개화 관료의 개혁이 겹치는 부분과 어긋나는 부분을 비교하자.\n\n동학농민군의 재봉기와 우금치 전투 — 일본의 경복궁 점령과 내정 개입에 맞서 농민군은 다시 봉기했다. 전봉준의 남접과 손병희의 북접이 연합했으나 공주 우금치 일대에서 일본군과 관군의 화력에 패했다. 1차 봉기의 폐정 개혁 요구에 더하여 2차 봉기에서는 일본의 침략을 막으려는 성격이 뚜렷해졌다. 재봉기의 패배 뒤 지도자들이 체포·처형되고 농민군에 대한 가혹한 탄압이 이어졌다. 전주 화약과 집강소 설치를 우금치 패배 뒤로 놓지 않는 것이 중요하다. 고부에서 전주로, 다시 공주로 이어지는 이동은 지역의 생계 저항이 전국적·반침략 운동으로 확대된 과정을 보여 준다.",
      "keyPoints": [
        "갑신정변: 김옥균·박영효, 우정총국, 청군 개입으로 실패",
        "동학: 고부 → 전주 화약·집강소 → 재봉기·우금치",
        "갑오개혁: 군국기무처·과거제 폐지·재정 일원화"
      ],
      "eventRefs": [
        {
          "topicId": "kr-modern-transition",
          "eventId": "gapsin-coup"
        },
        {
          "topicId": "kr-modern-transition",
          "eventId": "donghak-uprising"
        },
        {
          "topicId": "kr-modern-transition",
          "eventId": "gabo-reform"
        },
        {
          "topicId": "kr-modern-transition",
          "eventId": "ugeumchi-battle"
        }
      ],
      "sources": [
        "https://encykorea.aks.ac.kr/Article/E0000922",
        "https://encykorea.aks.ac.kr/Article/E0000923",
        "https://encykorea.aks.ac.kr/Article/E0016865",
        "https://encykorea.aks.ac.kr/Article/E0000925"
      ]
    },
    {
      "id": "s4",
      "title": "을미사변에서 독립협회로",
      "body": "청일전쟁 뒤 일본과 러시아의 세력 경쟁이 조선 정치에 영향을 주었다. 왕실의 위기 대응과 민간의 자주·민권 운동을 나란히 살핀다.\n\n을미사변과 을미의병 — 삼국 간섭 뒤 조선에서 러시아의 영향력이 커지자 일본 측은 왕비를 제거하는 폭력적 개입에 나섰다. 일본 공사 미우라 고로가 관여한 세력이 경복궁에서 왕비를 시해했다. 이후 추진된 을미개혁에는 태양력 채택과 단발령 등이 포함되어, 정치적 폭력과 생활 개혁이 겹쳐 강한 반발을 일으켰다. 왕비 시해와 단발령에 대한 분노로 유생을 중심으로 을미의병이 일어났다. 머리 모양의 변화만을 거부한 사건으로 축소하면 국권 침해에 대한 저항을 놓친다. 한편 고종은 신변 위협을 느껴 이듬해 러시아 공사관으로 옮겼고, 의병 운동과 왕실의 피신은 같은 위기에 대한 서로 다른 대응이었다.\n\n아관파천 — 고종은 경복궁을 떠나 러시아 공사관에 머물며 일본의 영향력이 강한 정권에서 벗어나려 했다. 이로써 친러 성향 내각이 들어섰지만 러시아와 여러 열강에 대한 의존도 커졌다. 한 나라의 압박을 다른 강대국의 도움으로 벗어나려는 외교가 자주권 회복으로 곧바로 이어지지는 않았다. 왕이 외국 공사관에 거처하는 상황은 국권과 이권 문제에 대한 사회적 위기의식을 높였다. 광산·철도 등 각종 이권을 둘러싼 열강의 경쟁도 심해졌다. 독립협회의 자주권 요구와 고종의 환궁, 대한제국 선포는 이러한 불안 속에서 이어지는 대응으로 연결해 읽을 수 있다.\n\n독립협회 창립 — 서재필 등이 참여한 독립협회는 독립문 건립과 토론·계몽 활동을 펼쳤다. 이후 러시아의 이권 요구 등에 반대하고 자주 국권과 민권 확대를 주장하는 정치 운동으로 발전했다. 처음부터 일제 강점기에 일본으로부터 독립하기 위해 만들어진 단체라고 이해하면 설립 시기와 배경을 잘못 잡게 된다. 신문과 공개 토론은 기존 관료 정치 밖의 사람들이 공적 문제를 논의하는 통로가 되었다. 다만 협회의 모든 인물이 같은 입장이 아니었고 열강에 대한 인식에도 한계가 있었다. 독립문은 청에 대한 종속적 관계를 벗어나려는 상징에서 출발해 뒤에 더 넓은 민족 독립의 상징으로 받아들여졌다.",
      "keyPoints": [
        "을미사변·단발령 → 을미의병",
        "1896 아관파천·독립협회",
        "독립문은 영은문을 대신한 자주독립의 상징"
      ],
      "eventRefs": [
        {
          "topicId": "kr-modern-transition",
          "eventId": "eulmi-incident"
        },
        {
          "topicId": "kr-modern-transition",
          "eventId": "agwan-pacheon"
        },
        {
          "topicId": "kr-modern-transition",
          "eventId": "independence-club"
        }
      ],
      "sources": [
        "https://encykorea.aks.ac.kr/Article/E0042948",
        "https://encykorea.aks.ac.kr/Article/E0034214",
        "https://encykorea.aks.ac.kr/Article/E0015993"
      ]
    },
    {
      "id": "s5",
      "title": "대한제국과 민권의 다른 구상",
      "body": "황제 중심의 자주적 근대화와 민중의 정치 참여 확대는 함께 등장했지만 충돌하기도 했다. 광무개혁은 구본신참, 독립협회는 자주·민권·자강을 단서로 읽는다.\n\n대한제국 선포와 광무개혁 — 고종은 환구단에서 황제에 즉위하고 대한제국을 선포했다. 구본신참을 내세운 광무개혁은 기존 질서를 바탕으로 새 제도를 받아들였으며, 양전과 지계 발급, 군대 강화, 근대 산업·교육 진흥 등을 추진했다. 1899년 대한국 국제는 황제에게 권력을 집중시켜 국가의 자주성과 황제권을 함께 강조했다. 토지 측량과 지계 발급은 소유 관계와 국가 재정을 정비하려는 사업이었다. 전차·전기·기술 교육의 확산은 도시 생활의 변화를 가져왔으나 재정 제약과 외세 간섭으로 개혁은 제한되었다. 의회와 민권을 강조한 독립협회의 구상과 황제 중심의 광무개혁은 근대화라는 목표 안에서도 방향이 달랐다.\n\n만민공동회와 헌의 6조 — 독립협회와 민중의 집회는 관민공동회로 이어져 헌의 6조를 채택했다. 외국에 의존하지 않는 국권 수호, 재정의 공개, 법에 따른 재판과 행정 등을 요구했으며 중추원 개편을 통한 정치 참여 확대를 추구했다. 그러나 보수 세력의 반발과 정부 탄압으로 협회는 해산되었다. 백정 출신 박성춘 등 다양한 사람들이 발언한 집회는 신분을 넘어 공적 의견을 내는 경험을 만들었다. 이는 갑오개혁의 법적 신분제 폐지 뒤 민권이 실제 정치 참여로 이어지는 장면이다. 황제권 강화와 민권 확대가 언제나 같은 방향으로 진행된 것은 아니라는 점도 드러난다.\n\n대한제국 칙령 제41호와 독도 — 대한제국은 칙령 제41호로 울릉도를 울도군으로 개편하고 관할 구역에 울릉전도·죽도·석도를 명시했다. 한국의 독도 영유권 설명에서는 석도를 독도로 해석하여 이 칙령을 행정 관할의 근거로 제시한다. 지도는 칙령 공포 장소인 서울이 아니라 그 관할 대상 중 독도를 표시한다. 울릉도와 주변 섬의 주민 이주와 어업은 행정 구역 정비의 배경이었다. 이후 러일전쟁 중인 1905년 일본의 독도 편입 조치는 한국의 주권 침탈 과정과 연결된다. 안용복의 활동, 1900년 칙령, 1905년 일본의 조치를 시기별로 구분하되 각각 다른 종류의 근거라는 점도 살펴야 한다.",
      "keyPoints": [
        "1897 대한제국 → 1898 관민공동회 → 1899 대한국 국제",
        "광무개혁: 양전·지계·산업과 기술 교육",
        "헌의 6조: 국권 수호·재정 공개·법에 따른 통치",
        "1900 칙령 제41호: 울도군 관할에 울릉전도·죽도·석도"
      ],
      "eventRefs": [
        {
          "topicId": "kr-modern-transition",
          "eventId": "korean-empire"
        },
        {
          "topicId": "kr-modern-transition",
          "eventId": "manmin-meeting"
        },
        {
          "topicId": "kr-modern-transition",
          "eventId": "dokdo-ordinance"
        }
      ],
      "sources": [
        "https://encykorea.aks.ac.kr/Article/E0005118",
        "https://encykorea.aks.ac.kr/Article/E0015187",